<?xml version="1.0" encoding="utf-8"?>
<xs:schema id="NewDataSet" xmlns="" xmlns:xs="http://www.w3.org/2001/XMLSchema" xmlns:msdata="urn:schemas-microsoft-com:xml-msdata">
  <xs:element name="chummer">
    <xs:complexType>
      <xs:sequence>
        <xs:element name="version" type="xs:string" minOccurs="0" />
        <xs:element name="ranges" minOccurs="0" maxOccurs="unbounded">
          <xs:complexType>
            <xs:sequence>
              <xs:element name="range" minOccurs="1" maxOccurs="unbounded">
                <xs:complexType>
                  <xs:sequence>
                    <xs:element name="name" type="xs:string" minOccurs="1" maxOccurs="1" />
                    <xs:element name="min" type="xs:string" minOccurs="0" maxOccurs="1" />
                    <xs:element name="short" type="xs:string" minOccurs="0" maxOccurs="1" />
                    <xs:element name="medium" type="xs:string" minOccurs="0" maxOccurs="1" />
                    <xs:element name="long" type="xs:string" minOccurs="0" maxOccurs="1" />
                    <xs:element name="extreme" type="xs:string" minOccurs="0" maxOccurs="1" />
                  </xs:sequence>
                </xs:complexType>
              </xs:element>
            </xs:sequence>
          </xs:complexType>
        </xs:element>
      </xs:sequence>
    </xs:complexType>
  </xs:element>
  <xs:element name="NewDataSet" msdata:IsDataSet="true" msdata:UseCurrentLocale="true">
    <xs:complexType>
      <xs:choice minOccurs="0" maxOccurs="unbounded">
        <xs:element ref="chummer" />
      </xs:choice>
    </xs:complexType>
  </xs:element>
</xs:schema>
